{
  "$schema": "https://json-schema.org/draft/2020-12/schema",
  "$id": "https://cartograph.example/contract/guidance/guidance.schema.json",
  "title": "Guidance",
  "description": "How to define one kind well, in one language: what it is in the discipline's words, what each field asks for with a right and a wrong example, what to ask when a link is missing, and how to meet each check. A person reads it beside the editor; an agent reads it before drafting. It holds words only: the steps, fields, links and checks are the flow's and the engine's, so a language is added by adding a bundle, and no rule depends on one. Examples are drawn from the fictional cooperative in examples/minimal, so every reader learns from the same model.",
  "type": "object",
  "required": [
    "locale",
    "kind",
    "summary",
    "definition",
    "fields"
  ],
  "additionalProperties": false,
  "properties": {
    "locale": {
      "type": "string",
      "pattern": "^[a-z]{2}(-[A-Z]{2})?$",
      "description": "BCP 47 language tag of the words, such as en or fr-CA."
    },
    "kind": {
      "type": "string"
    },
    "definition": {
      "type": "string",
      "description": "What this kind is, in the discipline's words (TAXONOMY.md), and what it is not."
    },
    "levels": {
      "type": "object",
      "description": "For a kind with levels (Goal: goal, objective, outcome): what each level is, as a dictionary gives it, in one plain sentence that does not repeat the level's name.",
      "additionalProperties": {
        "type": "string"
      }
    },
    "levelExamples": {
      "type": "object",
      "description": "For a kind with levels: one real instance of each level, held to the same rule as example.",
      "additionalProperties": {
        "type": "string",
        "maxLength": 160
      }
    },
    "terms": {
      "type": "object",
      "description": "Other words this kind holds that a person meets on screen, each defined as summary and example are (TAXONOMY.md D29): a project's component, say. The glossary lists them after the kind.",
      "additionalProperties": {
        "type": "object",
        "additionalProperties": false,
        "required": [
          "summary",
          "example"
        ],
        "properties": {
          "summary": {
            "type": "string",
            "maxLength": 160
          },
          "example": {
            "type": "string",
            "maxLength": 160
          }
        }
      }
    },
    "steps": {
      "type": "object",
      "description": "By step key: the step's title and guide in this language, where they differ from the flow's.",
      "additionalProperties": {
        "type": "object",
        "additionalProperties": false,
        "properties": {
          "title": {
            "type": "string"
          },
          "guide": {
            "type": "string"
          }
        }
      }
    },
    "fields": {
      "type": "object",
      "description": "By the field's JSON pointer, as the flow and the schema name it (list items as /spec/keyResults/-/metric).",
      "additionalProperties": {
        "$ref": "#/$defs/field"
      }
    },
    "links": {
      "type": "object",
      "description": "By Kind:/path, as the flow's link names it: what to ask when establishing the link, and what to do when there is nothing to link to.",
      "additionalProperties": {
        "type": "object",
        "required": [
          "ask",
          "ifNone"
        ],
        "additionalProperties": false,
        "properties": {
          "ask": {
            "type": "string"
          },
          "ifNone": {
            "type": "string"
          }
        }
      }
    },
    "checks": {
      "type": "object",
      "description": "By check id: how to meet it, in a sentence.",
      "additionalProperties": {
        "type": "string"
      }
    },
    "judgements": {
      "type": "object",
      "description": "Checks a decision model answers, where one is configured (docs/adr/0023), keyed by check id. Each is a contrast read off the field's good and poor examples: the text is placed between a good option and a poor one, asked good first, and the check is met when the good option is more likely. A contrast is kept only once it has been measured against examples whose answer is known (the ADR records how); without a model none is asked, and nothing else changes.",
      "additionalProperties": {
        "type": "object",
        "additionalProperties": false,
        "required": [
          "path",
          "good",
          "poor",
          "pass",
          "fail"
        ],
        "properties": {
          "path": {
            "type": "string",
            "description": "The field, by JSON pointer; - for every item of a list."
          },
          "levels": {
            "type": "array",
            "items": {
              "type": "string"
            },
            "description": "For a kind with levels, the levels it is asked at; all when left out."
          },
          "good": {
            "type": "object",
            "additionalProperties": false,
            "required": [
              "key",
              "label"
            ],
            "properties": {
              "key": {
                "type": "string",
                "pattern": "^[a-z]+$",
                "description": "A plain word naming the option; the model reads it."
              },
              "label": {
                "type": "string",
                "maxLength": 120,
                "description": "What the option is, in a few words."
              }
            }
          },
          "poor": {
            "type": "object",
            "additionalProperties": false,
            "required": [
              "key",
              "label"
            ],
            "properties": {
              "key": {
                "type": "string",
                "pattern": "^[a-z]+$",
                "description": "A plain word naming the option; the model reads it."
              },
              "label": {
                "type": "string",
                "maxLength": 120,
                "description": "What the option is, in a few words."
              }
            }
          },
          "pass": {
            "type": "string",
            "maxLength": 160
          },
          "fail": {
            "type": "string",
            "maxLength": 160,
            "description": "What to say when the poor option is more likely; {n} is the item's number in a list."
          },
          "opens": {
            "type": "array",
            "items": {
              "type": "string",
              "minLength": 1
            },
            "description": "The words a poor text starts with, lowercase: a text that opens with none of them is good without asking the model, which reads a passive or modal state as an action."
          }
        }
      }
    },
    "cues": {
      "type": "object",
      "description": "How a decision model recognises a text a person typed as this kind (docs/adr/0023), by stage key. Asked of each stage on its own, good option first, against \"something else\"; the three likeliest stages are offered to the person, who chooses. A stage with levels and no cue is asked by its level's definition (levels), the same words a person reads, and its level is chosen among them. Changed only with a new measurement against sentences whose stage is known.",
      "additionalProperties": false,
      "patternProperties": {
        "^[a-z]+$": {
          "type": "string",
          "maxLength": 160
        }
      }
    },
    "fromIdea": {
      "type": "object",
      "description": "The questions a rough idea is read for (docs/adr/0023), keyed by a short name: each the question a step asks, the field it fills, and the cue a decision model is asked whether a sentence matches. Asked of each sentence on its own; a sentence is offered only when the model is sure of it and it is clear of the next. Changed only with a new measurement.",
      "additionalProperties": {
        "type": "object",
        "additionalProperties": false,
        "required": [
          "question",
          "field",
          "cue"
        ],
        "properties": {
          "question": {
            "type": "string",
            "maxLength": 120
          },
          "field": {
            "type": "string",
            "pattern": "^/"
          },
          "cue": {
            "type": "string",
            "maxLength": 160
          }
        }
      }
    },
    "vocabulary": {
      "type": "object",
      "description": "Words an interface offers to help write a field in this language, such as the verbs an aim opens with or the word that introduces an objective's means. Offered, never used to judge: no check or mark depends on them, and a language without them gets plain fields.",
      "additionalProperties": {
        "type": "array",
        "items": {
          "type": "string"
        },
        "minItems": 1
      }
    },
    "summary": {
      "type": "string",
      "maxLength": 160,
      "description": "What the kind is, as a dictionary gives it, for a person meeting the word for the first time: one plain sentence in everyday words that does not repeat the kind's name, and names no standard, field or identifier (TAXONOMY.md D29). Shown wherever a list of kinds names it, beside a \"?\" where the word appears, and in the glossary."
    },
    "example": {
      "type": "string",
      "maxLength": 160,
      "description": "One real instance of the kind, from the example workspace, that shows every part the summary names (a gap's state today and the state it should reach, not only one) in words a newcomer knows. Shown under the summary."
    },
    "knownAs": {
      "type": "array",
      "items": {
        "type": "string"
      },
      "description": "What plans and documents often call this kind instead, in this language: for recognising one, never for naming it. A document's word is mapped by what the thing is, against the definition, so a plan's \"objective\" may be an outcome here, and the kind's own name is always used."
    }
  },
  "$defs": {
    "field": {
      "type": "object",
      "required": [
        "guide"
      ],
      "additionalProperties": false,
      "properties": {
        "guide": {
          "type": "string",
          "description": "What the field asks for, in the discipline's words."
        },
        "good": {
          "type": "array",
          "items": {
            "type": "string"
          },
          "description": "Values written as the discipline would."
        },
        "poor": {
          "type": "array",
          "items": {
            "type": "object",
            "required": [
              "text",
              "why"
            ],
            "additionalProperties": false,
            "properties": {
              "text": {
                "type": "string"
              },
              "why": {
                "type": "string"
              }
            }
          },
          "description": "Values that read plausibly and are wrong, each with why."
        },
        "levels": {
          "type": "object",
          "description": "For a kind with levels: the guide and examples for one level, where they differ.",
          "additionalProperties": {
            "$ref": "#/$defs/field"
          }
        }
      }
    }
  }
}
