{
  "locale": "en",
  "kind": "FundingSource",
  "summary": "A pot of money that pays for work, such as a budget line or a grant.",
  "example": "Cooperative operating budget, which pays for the Quality Check Rollout.",
  "knownAs": [
    "budget",
    "budget line",
    "grant",
    "fund",
    "cost centre"
  ],
  "definition": "A budget, grant or fund that pays for work, with the code your finance records give it. Each project's funding names the budget it draws from. It is not a resource (a role, team, partner, system or place the work needs), and not a project's funding line, which says how much that project takes from it.",
  "steps": {},
  "fields": {
    "/metadata/name": {
      "guide": "The budget's name."
    },
    "/spec/code": {
      "guide": "The budget's code in your finance records, such as a fund or grant number, copied exactly. Leave it empty if your budgets have no codes.",
      "good": [
        "BUD-2025-Q4-07"
      ],
      "poor": [
        {
          "text": "the ops one",
          "why": "Not the budget's code. Copy the code exactly, or leave it empty."
        }
      ]
    },
    "/spec/heldBy": {
      "guide": "The unit or partner responsible for the budget, chosen from your resources. Add it as a resource first if it is missing.",
      "good": [
        "depot-network"
      ],
      "poor": [
        {
          "text": "Ada Okafor",
          "why": "A person. Choose the unit or partner instead."
        }
      ]
    },
    "/spec/period": {
      "guide": "The span the budget covers, as the organisation names it: a financial year, a season, a grant term.",
      "good": [
        "2025 season"
      ],
      "poor": [
        {
          "text": "ongoing",
          "why": "Say which period the budget covers."
        }
      ]
    },
    "/spec/note": {
      "guide": "Anything else about the budget, such as what it is meant to cover.",
      "good": [
        "Covers the depots' running costs, including anything bought for them mid-season."
      ],
      "poor": [
        {
          "text": "42000 USD approved for the rollout",
          "why": "Put the amount one project uses on that project's funding instead."
        }
      ]
    }
  },
  "links": {},
  "checks": {}
}
