{
  "locale": "en",
  "kind": "ReportingCycle",
  "summary": "How often numbers are checked, such as every month, every season or every year.",
  "example": "Monthly Cycle: the numbers on it are checked once a month.",
  "knownAs": [
    "reporting period",
    "reporting frequency",
    "review cycle",
    "quarterly reporting"
  ],
  "definition": "How often numbers are reported, and when each report is due. A cycle is equal periods of months, such as every three months from September, equal periods of days, such as every two weeks from a Monday, or named periods, such as terms or survey rounds, each named by the month it ends. It also says how many days after a period ends the report is due. Each KPI names one cycle. It is not how often a data source changes, not the time span of a goal, and not a single report.",
  "fields": {
    "/spec/periodMonths": {
      "guide": "How many months each period lasts: 1, 3, 6 or 12. Choose one your data sources can keep up with.",
      "good": [
        "3, for a season of deliveries"
      ],
      "poor": [
        {
          "text": "1, for measures read from forms transcribed once a season",
          "why": "The source only has new numbers once a season, so most months would have nothing to report."
        }
      ]
    },
    "/spec/startMonth": {
      "guide": "The month the first period starts, from 1 to 12. This sets which month each period ends in.",
      "good": [
        "9, for a cooperative whose season year opens in September"
      ],
      "poor": [
        {
          "text": "1, for a seasonal cycle when the season year opens in September",
          "why": "Periods would end in March, June, September and December, cutting across the seasons the readings describe."
        }
      ]
    },
    "/spec/periodDays": {
      "guide": "How many days each period lasts: 1, 7 or 14, for a number read daily, weekly or every two weeks. Choose one your data sources can keep up with; a reading is then filed by the day its period ends.",
      "good": [
        "7, for orders a buyer places each week"
      ],
      "poor": [
        {
          "text": "1, for a number read from a source refreshed each month",
          "why": "The source has a new number once a month, so most days would have nothing to report."
        }
      ]
    },
    "/spec/startDate": {
      "guide": "The first day of one of its periods, as YYYY-MM-DD. The other periods line up with it.",
      "good": [
        "2026-01-05, a Monday, for weeks that run Monday to Sunday"
      ],
      "poor": [
        {
          "text": "2026-01-07, a Wednesday, when the depots report Monday to Sunday",
          "why": "Every period would cut across the week the readings describe."
        }
      ]
    },
    "/spec/periods": {
      "guide": "Named periods, for when equal months do not fit, such as terms or survey rounds. Give each a name and the month it ends: a month of the year if it repeats, or a year and month if it happens once.",
      "good": [
        "Term I ends in month 12, Term II in 4, Term III in 7",
        "Baseline wave ends 2026-12, follow-up wave 2027-12"
      ],
      "poor": [
        {
          "text": "Quarterly, for readings taken at the end of each term",
          "why": "Quarters end in March, June, September and December, which are not when terms end. Name the terms instead."
        },
        {
          "text": "Irregular, as data sources allow",
          "why": "With no periods, a missed reading cannot show. Name the waves by the month each ends."
        }
      ]
    },
    "/spec/periods/-/name": {
      "guide": "The period's name. Each name must be different.",
      "good": [
        "Term I",
        "Baseline wave"
      ]
    },
    "/spec/periods/-/endMonth": {
      "guide": "For a period that repeats each year: the month it ends, 1 to 12. The year starts the month after the last period ends."
    },
    "/spec/periods/-/end": {
      "guide": "For a period that happens once: the year and month it ends."
    },
    "/spec/dueOffsetDays": {
      "guide": "How many days after a period ends the report is due.",
      "good": [
        "14, for a seasonal cycle whose forms are transcribed in the two weeks after the season"
      ],
      "poor": [
        {
          "text": "0, when the figures take weeks to transcribe",
          "why": "Every round would be late on the day it closes."
        }
      ]
    },
    "/metadata/name": {
      "guide": "The cycle's name, such as Monthly."
    }
  },
  "links": {
    "KPI:/spec/cycle": {
      "ask": "Which KPIs are read on this cycle?",
      "ifNone": "None yet is fine. A KPI names this cycle when you set how it is measured."
    }
  }
}
