{
  "locale": "en",
  "kind": "BeneficiaryGroup",
  "summary": "A group of people your work is meant to help.",
  "example": "Depot staff, whom the Quality Check Rollout is meant to help.",
  "knownAs": [
    "target group",
    "beneficiaries",
    "population",
    "audience",
    "client group",
    "stakeholder group served"
  ],
  "definition": "A group of people your projects, programmes or operations are meant to help. It says who they are, not how many. It is not a segment (a part you compare numbers across), not a stakeholder (someone with a say in the work), not a single person, and not the team or role doing the work.",
  "steps": {},
  "fields": {
    "/metadata/name": {
      "guide": "A short plural name for the group, in the words your organisation uses.",
      "good": [
        "Delivering members",
        "Retail partners",
        "Seasonal workers"
      ],
      "poor": [
        {
          "text": "Members (about 1,200)",
          "why": "Leave the count out. The name says who; numbers come from a data source."
        },
        {
          "text": "Better prices for members",
          "why": "A benefit, not a group. Name the people who get it."
        },
        {
          "text": "Field officer",
          "why": "A role that does the work, not people the work helps. Add it as a resource."
        }
      ]
    },
    "/spec/description": {
      "guide": "Who is in the group and who is not, in one sentence without numbers.",
      "good": [
        "Members who deliver produce to a depot during the season.",
        "Workers hired by members for harvest and delivery during the peak months."
      ],
      "poor": [
        {
          "text": "Members.",
          "why": "Repeats the name and does not say who is in or out: every member, or only those who deliver?"
        },
        {
          "text": "Everyone who benefits from the cooperative.",
          "why": "Too broad to sort anyone by, and it describes a benefit rather than a group."
        }
      ]
    },
    "/spec/source": {
      "guide": "The data source that lists the people in this group. Leave it empty if none does.",
      "good": [
        "member-register",
        "member-survey"
      ],
      "poor": [
        {
          "text": "collection-log",
          "why": "It records collections, not who is in the group."
        }
      ]
    }
  },
  "links": {
    "Project:/spec/summary/beneficiaries/-/group": {
      "ask": "Which projects are meant to help this group?",
      "ifNone": "None yet is fine. A project names this group when it is meant to help them."
    },
    "Programme:/spec/problems/-/groups/-": {
      "ask": "Which programme problems affect this group?",
      "ifNone": "None yet is fine. A programme names this group on each problem that affects them."
    }
  }
}
